{
  "object_type": "payment_requirement",
  "contract_version": "0.2.0",
  "created_at": "2026-08-06T10:00:00Z",
  "requirement_id": "x402-preq-0001",
  "amount": { "currency_code": "USD", "value": "5.00" },
  "payee_ref": { "ref_type": "merchant", "id": "merchant-x402-001" },
  "resource_ref": { "ref_type": "resource", "id": "api-path-article-42" },
  "accepted_methods": ["x402"],
  "expires_at": "2026-08-06T10:30:00Z",
  "native": {
    "protocol_family": "x402",
    "protocol_version": "1",
    "native_object_type": "PaymentRequiredResponse",
    "digest": {
      "algorithm": "sha-256",
      "encoding": "hex",
      "value": "a1a1a1a1a1a1a1a1a1a1a1a1a1a1a1a1a1a1a1a1a1a1a1a1a1a1a1a1a1a1a1a1"
    },
    "custody": { "disposition": "caller_retained" },
    "captured_at": "2026-08-06T10:00:00Z"
  }
}
