{
  "object_type": "payment_requirement",
  "contract_version": "0.2.0",
  "created_at": "2026-08-06T13:00:00Z",
  "requirement_id": "ucp-preq-0001",
  "amount": { "currency_code": "USD", "value": "49.95" },
  "payee_ref": { "ref_type": "merchant", "id": "merchant-ucp-001" },
  "resource_ref": { "ref_type": "resource", "id": "resource-ucp-digital-good-001" },
  "accepted_methods": ["ucp-wallet", "ucp-card"],
  "expires_at": "2026-08-06T13:15:00Z",
  "native": {
    "protocol_family": "UCP",
    "protocol_version": "1.1",
    "native_object_type": "PaymentChallenge",
    "digest": {
      "algorithm": "sha-256",
      "encoding": "hex",
      "value": "2c2c2c2c2c2c2c2c2c2c2c2c2c2c2c2c2c2c2c2c2c2c2c2c2c2c2c2c2c2c2c2c"
    },
    "custody": { "disposition": "caller_retained" },
    "captured_at": "2026-08-06T13:00:00Z"
  }
}
